{
  "generated_at": "2026-03-14T00:00:00Z",
  "repo_root": "skill-builder",
  "primary_languages": ["TypeScript", "TSX", "Rust", "Markdown"],
  "package_managers": [
    {
      "name": "npm",
      "lockfile": "app/package-lock.json",
      "manifest": "app/package.json",
      "workspaces": ["app/sidecar"]
    },
    {
      "name": "npm (sidecar)",
      "lockfile": "app/sidecar/package-lock.json",
      "manifest": "app/sidecar/package.json"
    },
    {
      "name": "cargo",
      "lockfile": "app/src-tauri/Cargo.lock",
      "manifest": "app/src-tauri/Cargo.toml"
    }
  ],
  "build_systems": [
    {
      "name": "Tauri 2",
      "config_files": ["app/src-tauri/tauri.conf.json", "app/src-tauri/Cargo.toml"],
      "notes": "Bundles frontend (Vite), Rust backend, sidecar dist, and agent-sources as app resources. Identifier: com.vibedata.skill-builder. CSP allows Anthropic API + GitHub API. Dev port: DEV_PORT (default 1420), HMR on DEV_PORT+1."
    },
    {
      "name": "Vite 7",
      "config_files": ["app/vite.config.ts", "app/tsconfig.json"],
      "notes": "React + Tailwind plugin. Path alias `@/` → `./src/`. E2E mock path alias via TAURI_E2E env var."
    },
    {
      "name": "esbuild (sidecar)",
      "config_files": ["app/sidecar/build.js"],
      "notes": "Compiles TypeScript sidecar to `app/sidecar/dist/` for Tauri bundling. No hot-reload — restart `npm run dev` after editing sidecar source."
    },
    {
      "name": "GitHub Actions",
      "config_files": [
        ".github/workflows/pr-ci.yml",
        ".github/workflows/pr-policy.yml",
        ".github/workflows/security.yml",
        ".github/workflows/docs.yml",
        ".github/workflows/release.yml",
        ".github/workflows/sync-skill-creator.yml",
        ".github/workflows/sync-vd-agent.yml"
      ],
      "notes": "pr-ci.yml: platform CI (Linux/Windows/macOS) + frontend unit/integration. pr-policy.yml: docs build, agents-structural, instruction-docs-lint, repo-map-audit, test-manifest-audit. security.yml: dependency-review, CodeQL, cargo-audit. docs.yml: VitePress GitHub Pages deploy. release.yml: multi-platform Tauri build + publish."
    }
  ],
  "test_frameworks": [
    {
      "name": "Vitest",
      "config_files": ["app/vitest.config.ts", "app/vitest.config.agent.ts"],
      "scope": "Frontend unit/integration + agent structural validation"
    },
    {
      "name": "Playwright",
      "config_files": ["app/playwright.config.ts"],
      "scope": "E2E tests in app/e2e/"
    },
    {
      "name": "Promptfoo",
      "scope": "Agent smoke tests (live API calls — manual only, do not run autonomously)"
    },
    {
      "name": "cargo test",
      "scope": "Rust unit tests in app/src-tauri/src/"
    }
  ],
  "applications": [
    {
      "name": "Skill Builder Desktop",
      "type": "Tauri v2 desktop app",
      "description": "Multi-agent workflow for creating domain-specific Claude skills. React frontend + Rust backend + Node.js agent sidecar.",
      "identifier": "com.vibedata.skill-builder"
    }
  ],
  "entrypoints": {
    "frontend": "app/src/main.tsx",
    "rust_backend": "app/src-tauri/src/main.rs",
    "rust_lib": "app/src-tauri/src/lib.rs",
    "sidecar": "app/sidecar/agent-runner.ts",
    "sidecar_build": "app/sidecar/build.js"
  },
  "modules": {
    "frontend_components": {
      "path": "app/src/components/",
      "description": "Reusable UI components. Sub-directories: agent-items/ (display item renderers: base, bare-output, error, output, result, subagent, thinking, tool, tool-activity-group), layout/ (app-layout, sidebar/icon-rail), refine/ (chat panel, chat input, preview panel, git patch view, benchmark-prompt-inline, refine-question-inline), settings/ (general, github, marketplace, sdk, advanced, usage sections), ui/ (shadcn/ui primitives), workspace/ (workspace-shell, workspace-overview, workspace-refine, workspace-evals, test-case-form, benchmark-overview-card — shown when a complete/imported/marketplace skill is selected in app-layout), step-complete/ (per-step completion views: research, detailed-research, decisions, benchmark, file-viewer + shared hooks use-step-files, use-benchmark-data). Flat components include skill-list-panel (260px panel), skill cards, dialogs (delete, import, github, skill, feedback, reset, transition-gate), clarifications-editor, agent panels, and more."
    },
    "frontend_pages": {
      "path": "app/src/pages/",
      "description": "Page-level route components: dashboard, workflow, settings"
    },
    "frontend_stores": {
      "path": "app/src/stores/",
      "description": "Zustand state stores: agent (+ agent-display-buffer), auth, imported-skills, refine, settings, skill, test, usage, workflow"
    },
    "frontend_hooks": {
      "path": "app/src/hooks/",
      "description": "Custom React hooks: agent streaming, workflow state machine, workflow session/persistence/autosave, settings form, scope blocking, marketplace registries, marketplace updates, app startup, node validation, leave guard"
    },
    "frontend_lib": {
      "path": "app/src/lib/",
      "description": "Utilities and shared types: tauri.ts (typed Tauri command wrappers), types.ts (shared TS types), agent-events.ts (frontend AgentEvent types), display-types.ts (DisplayItem types), agent-results.ts (result parsing), models.ts (model list), workflow-steps.ts + workflow-step-configs.ts (step definitions), workflow-teardown.ts (shared workflow session teardown helper), clarifications-types.ts, path-utils.ts, app-log.ts, help-urls.ts, toast.ts, utils.ts"
    },
    "rust_commands": {
      "path": "app/src-tauri/src/commands/",
      "description": "Tauri command handlers. Flat files: agent, api_validation, evals (list_test_cases, save_test_case, delete_test_case, list_iterations), feedback, files, git, github_auth, lifecycle, node, reconciliation, settings, sidecar_lifecycle, test_utils, usage, workflow_artifacts, workflow_lifecycle, workflow_session, workspace. Sub-module directories: workflow/ (step_config, deploy, claude_md, output_format, packaging, runtime, evaluation, tests), imported_skills/ (frontmatter, helpers, bundled, lifecycle, listing, upload), github_import/ (http, url, catalog, import, commands), skill/ (crud, metadata, suggestions, tests), refine/ (content, diff, output, protocol, tests)"
    },
    "rust_db": {
      "path": "app/src-tauri/src/db/",
      "description": "SQLite schema, migrations (code-only), and query helpers. Sub-modules: mod.rs (Db struct, init_db, pub use re-exports), migrations.rs (NUMBERED_MIGRATIONS + migration functions), skills.rs (skill CRUD/workflow runs/steps/tags), usage.rs (persist_agent_run/usage queries), settings.rs (read/write settings), imported_skills.rs (imported skill CRUD/hash tracking), locks.rs (skill locks/check_pid_alive), workflow.rs (workflow sessions), tests.rs (all DB tests)."
    },
    "rust_agents": {
      "path": "app/src-tauri/src/agents/",
      "description": "Agent runtime. Files: sidecar_pool/ (directory module — pool.rs: SidecarPool struct + idle cleanup, dispatch.rs: request dispatch + streaming + shutdown, process.rs: process primitives + heartbeat + stdout handler, startup_error.rs: SidecarStartupError + terminal status), events.rs (routes agent_event subtypes, persists run_result, emits Tauri frontend events), sidecar.rs (sidecar process spawning), sidecar_path.rs (resolves sidecar binary path), node_resolver.rs (Node.js binary resolution with platform-specific logic)."
    },
    "sidecar_runner": {
      "path": "app/sidecar/agent-runner.ts",
      "description": "Entry point: reads stdin JSON config, calls SDK query(), streams JSONL events to stdout"
    },
    "sidecar_events": {
      "path": "app/sidecar/agent-events.ts",
      "description": "Canonical AgentEvent type definitions — service boundary contract between sidecar and Rust"
    },
    "sidecar_core": {
      "path": "app/sidecar/",
      "description": "Supporting sidecar modules: persistent-mode.ts (message demultiplexer, routes one-shot vs streaming requests), run-agent.ts (executes a single agent request), stream-session.ts (async generator push pattern for multi-turn streaming), message-processor.ts (transforms SDK messages into DisplayItems and AgentEvents), message-classifier.ts (classifies SDK message types), run-metadata-accumulator.ts (accumulates run-level metadata), tool-summaries.ts (context-aware tool call summaries), display-types.ts (DisplayItem types), config.ts + options.ts (SDK config builders), error-labels.ts (user-facing error strings), shutdown.ts (graceful shutdown handler)"
    },
    "sidecar_mock": {
      "path": "app/sidecar/mock-agent.ts",
      "description": "Mock mode: replays bundled templates with no API calls. Activated via MOCK_AGENTS=true."
    },
    "agent_prompts": {
      "path": "agent-sources/agents/",
      "description": "Flat directory of .md agent prompts: answer-evaluator. Plugin-hosted agents: generate-skill and rewrite-skill under agent-sources/plugins/skill-creator/agents/; research-orchestrator, detailed-research, and confirm-decisions under agent-sources/plugins/skill-content-researcher/agents/. Plugin-hosted skills: skill-evaluator and skill-validator under agent-sources/plugins/skill-creator/skills/"
    },
    "agent_plugins": {
      "path": "agent-sources/plugins/",
      "description": "Plugin definitions: skill-content-researcher, skill-creator, vd-agent"
    },
    "workspace_instructions": {
      "path": "agent-sources/workspace/",
      "description": "Agent workspace instructions deployed at startup. CLAUDE.md (full instructions → workspace .claude/CLAUDE.md), CLAUDE-MINIMAL.md (lightweight variant), prompts/ (shared prompt fragments injected into workspace)"
    },
    "rust_reconciliation": {
      "path": "app/src-tauri/src/reconciliation/",